{"schemaVersion":"1.0","traceId":"synthetic-non-contiguous","source":{"name":"fixture-generator","version":"1.0"},"createdAt":"2026-01-01T00:00:00Z","events":[{"id":"nc-evt-0","sequence":0,"timestamp":"2026-01-01T00:00:01Z","type":"synthetic","actor":"system","payload":{},"provenance":{"sourceEventId":"nc-source-0"}},{"id":"nc-evt-1","sequence":5,"timestamp":"2026-01-01T00:00:02Z","type":"synthetic","actor":"system","payload":{},"provenance":{"sourceEventId":"nc-source-1"}},{"id":"nc-evt-2","sequence":12,"timestamp":"2026-01-01T00:00:03Z","type":"synthetic","actor":"system","payload":{},"provenance":{"sourceEventId":"nc-source-2"}},{"id":"nc-evt-3","sequence":20,"timestamp":"2026-01-01T00:00:04Z","type":"synthetic","actor":"system","payload":{},"provenance":{"sourceEventId":"nc-source-3"}}]}
