{
  "createdAt": "2026-01-01T00:00:00Z",
  "events": [
    {
      "actor": "system",
      "id": "event-001",
      "payload": {
        "annotationKind": "operator-authored-projection",
        "label": "review satisfied",
        "observedMetadata": {
          "authorityDigest": "00bcb8376a15bdcc55c4ff9269193c9e844284e7bf44441ee04ef101cced3745",
          "candidateCommit": "f571e18aa4447dee42bb2e7c942380518d331bf6",
          "mergeCommit": "7421692e7790d3622ec2d71b7156262c79cea42d",
          "metadataKind": "observed-closeout-metadata",
          "postMergeCiStatus": "completed",
          "sourceDigest": "302a294971271489ba0a67b81b4aeae4f450dd888761ee882e73aaef3e5337ee",
          "sourceType": "final-pr-closeout",
          "status": "MERGED_POST_MERGE_CI_AND_CLEANROOM_VERIFIED",
          "task": "phase-2b-baseline-comparison"
        }
      },
      "provenance": {
        "sourceEventId": "synthetic-phase-2b-semantic-review-and-integration-001"
      },
      "sequence": 0,
      "timestamp": "2026-01-01T00:00:00Z",
      "type": "redacted-projection"
    },
    {
      "actor": "system",
      "id": "event-002",
      "payload": {
        "annotationKind": "operator-authored-projection",
        "label": "integration satisfied"
      },
      "provenance": {
        "sourceEventId": "synthetic-phase-2b-semantic-review-and-integration-002"
      },
      "sequence": 1,
      "timestamp": "2026-01-02T00:00:00Z",
      "type": "redacted-projection"
    },
    {
      "actor": "system",
      "id": "event-003",
      "payload": {
        "annotationKind": "operator-authored-projection",
        "label": "hosted verification satisfied"
      },
      "provenance": {
        "sourceEventId": "synthetic-phase-2b-semantic-review-and-integration-003"
      },
      "sequence": 2,
      "timestamp": "2026-01-03T00:00:00Z",
      "type": "redacted-projection"
    },
    {
      "actor": "system",
      "id": "event-004",
      "payload": {
        "annotationKind": "operator-authored-projection",
        "label": "normal completion"
      },
      "provenance": {
        "sourceEventId": "synthetic-phase-2b-semantic-review-and-integration-004"
      },
      "sequence": 3,
      "timestamp": "2026-01-04T00:00:00Z",
      "type": "redacted-projection-terminal"
    }
  ],
  "schemaVersion": "1.0",
  "source": {
    "name": "experimental-redacted-projection-adapter",
    "version": "0"
  },
  "traceId": "redacted-phase-2b-semantic-review-and-integration"
}
