{
  "schemaVersion": "1.0",
  "traceId": "synthetic-multi-event",
  "source": {
    "name": "fixture-generator",
    "version": "1.0"
  },
  "createdAt": "2026-01-01T00:00:00Z",
  "events": [
    {
      "id": "event-001",
      "sequence": 0,
      "timestamp": "2026-01-01T00:00:01Z",
      "type": "message",
      "actor": "user",
      "payload": {
        "text": "synthetic request",
        "extension": {
          "preserved": true
        }
      },
      "provenance": {
        "sourceEventId": "source-001"
      }
    },
    {
      "id": "event-002",
      "sequence": 1,
      "timestamp": "2026-01-01T00:00:02Z",
      "type": "message",
      "actor": "assistant",
      "payload": {
        "text": "synthetic response"
      },
      "provenance": {
        "sourceEventId": "source-002"
      }
    }
  ]
}
